{
  "software_classification": "桌面客户端",
  "software_purpose": "帮助工作人员对选定目录中的脱敏文件执行格式和命名校验。",
  "target_users": "需要完成该项业务的内部工作人员与系统维护人员",
  "industry_domain": "通用软件工具",
  "development_purpose": "帮助工作人员对选定目录中的脱敏文件执行格式和命名校验。",
  "development_environment": "Windows、macOS或Linux开发环境",
  "development_tools": "Python 3.10+及项目对应编译运行工具",
  "runtime_platform": "桌面客户端",
  "runtime_support": "具备文件读写权限的常规计算机环境",
  "main_functions": "软件围绕帮助工作人员对选定目录中的脱敏文件执行格式和命名校验。提供统一入口。使用者可从客户端主窗口的‘选择目录’按钮进入，查看目录输入框、校验规则区、进度列表和结果摘要，按照明确步骤完成输入、执行与结果核验。系统对必填项、输入路径和操作状态进行校验；成功时给出可见反馈，失败时保留原因并允许修正后重试。操作记录使用脱敏标识，演示数据不包含真实个人信息。该演示只描述源码与截图中能够核验的能力，用于展示申请材料如何保持表单、手册、截图与代码一致。",
  "technical_features": "采用分层输入校验、确定性结果输出和明确错误状态，核心实现均可由源码行号追溯。",
  "startup": "按照项目README中的启动入口运行，看到主界面或命令帮助即表示启动成功。",
  "interface_structure": "主要操作区域包括目录输入框、校验规则区、进度列表和结果摘要。",
  "workflow_summary": "进入功能、提供输入、执行处理、查看结果、按提示修正异常。",
  "capabilities": [
    {
      "id": "CAP-core",
      "name": "核心处理",
      "purpose": "帮助工作人员对选定目录中的脱敏文件执行格式和命名校验。",
      "actor": "内部工作人员",
      "entry": "客户端主窗口的‘选择目录’按钮",
      "visible_elements": "目录输入框、校验规则区、进度列表和结果摘要",
      "steps": [
        "启动客户端并打开主窗口",
        "选择包含脱敏文件的目录",
        "勾选需要执行的校验规则",
        "点击开始校验并等待完成"
      ],
      "restrictions": [
        "只使用脱敏演示数据",
        "输入必须满足界面或命令提示"
      ],
      "success_feedback": "进度列表逐项完成，结果区显示通过数量与需处理数量。",
      "error_feedback": "目录不存在或没有读取权限时，窗口显示原因并保持开始按钮可再次操作。",
      "evidence_ids": [
        "FILE-core",
        "RUNTIME-core"
      ],
      "screenshot_ids": [
        "user-shot-001"
      ]
    }
  ],
  "faq": [
    {
      "question": "操作失败后如何处理？",
      "answer": "目录不存在或没有读取权限时，窗口显示原因并保持开始按钮可再次操作。"
    }
  ],
  "terms": [
    {
      "term": "脱敏数据",
      "description": "不包含可识别真实个人或组织的信息。"
    }
  ],
  "confirmed_against_runtime": true,
  "generated_from_evidence": true
}
