{
  "software_classification": "命令行工具",
  "software_purpose": "帮助开发和运维人员对脱敏文本数据生成数量、长度和分组摘要。",
  "target_users": "需要完成该项业务的内部工作人员与系统维护人员",
  "industry_domain": "通用软件工具",
  "development_purpose": "帮助开发和运维人员对脱敏文本数据生成数量、长度和分组摘要。",
  "development_environment": "Windows、macOS或Linux开发环境",
  "development_tools": "Python 3.10+及项目对应编译运行工具",
  "runtime_platform": "命令行工具",
  "runtime_support": "具备文件读写权限的常规计算机环境",
  "main_functions": "软件围绕帮助开发和运维人员对脱敏文本数据生成数量、长度和分组摘要。提供统一入口。使用者可从终端中的 summary-cli 命令进入，查看命令参数帮助、处理进度和结构化摘要结果，按照明确步骤完成输入、执行与结果核验。系统对必填项、输入路径和操作状态进行校验；成功时给出可见反馈，失败时保留原因并允许修正后重试。操作记录使用脱敏标识，演示数据不包含真实个人信息。该演示只描述源码与截图中能够核验的能力，用于展示申请材料如何保持表单、手册、截图与代码一致。",
  "technical_features": "采用分层输入校验、确定性结果输出和明确错误状态，核心实现均可由源码行号追溯。",
  "startup": "按照项目README中的启动入口运行，看到主界面或命令帮助即表示启动成功。",
  "interface_structure": "主要操作区域包括命令参数帮助、处理进度和结构化摘要结果。",
  "workflow_summary": "进入功能、提供输入、执行处理、查看结果、按提示修正异常。",
  "capabilities": [
    {
      "id": "CAP-core",
      "name": "核心处理",
      "purpose": "帮助开发和运维人员对脱敏文本数据生成数量、长度和分组摘要。",
      "actor": "内部工作人员",
      "entry": "终端中的 summary-cli 命令",
      "visible_elements": "命令参数帮助、处理进度和结构化摘要结果",
      "steps": [
        "在终端查看命令帮助",
        "指定脱敏输入文件和输出目录",
        "执行摘要命令",
        "检查退出状态和生成的摘要文件"
      ],
      "restrictions": [
        "只使用脱敏演示数据",
        "输入必须满足界面或命令提示"
      ],
      "success_feedback": "命令返回退出状态0，并在目标目录生成摘要JSON文件。",
      "error_feedback": "输入文件不存在或格式错误时，命令输出明确错误原因并返回非0退出状态。",
      "evidence_ids": [
        "FILE-core",
        "RUNTIME-core"
      ],
      "screenshot_ids": [
        "user-shot-001"
      ]
    }
  ],
  "faq": [
    {
      "question": "操作失败后如何处理？",
      "answer": "输入文件不存在或格式错误时，命令输出明确错误原因并返回非0退出状态。"
    }
  ],
  "terms": [
    {
      "term": "脱敏数据",
      "description": "不包含可识别真实个人或组织的信息。"
    }
  ],
  "confirmed_against_runtime": true,
  "generated_from_evidence": true
}
