{
  "software_classification": "Web管理系统",
  "software_purpose": "帮助内部服务人员查看、筛选并处理脱敏工单记录。",
  "target_users": "需要完成该项业务的内部工作人员与系统维护人员",
  "industry_domain": "通用软件工具",
  "development_purpose": "帮助内部服务人员查看、筛选并处理脱敏工单记录。",
  "development_environment": "Windows、macOS或Linux开发环境",
  "development_tools": "Python 3.10+及项目对应编译运行工具",
  "runtime_platform": "Web管理系统",
  "runtime_support": "具备文件读写权限的常规计算机环境",
  "main_functions": "软件围绕帮助内部服务人员查看、筛选并处理脱敏工单记录。提供统一入口。使用者可从浏览器首页的‘工单列表’菜单进入，查看筛选区、工单表格、状态列和详情按钮，按照明确步骤完成输入、执行与结果核验。系统对必填项、输入路径和操作状态进行校验；成功时给出可见反馈，失败时保留原因并允许修正后重试。操作记录使用脱敏标识，演示数据不包含真实个人信息。该演示只描述源码与截图中能够核验的能力，用于展示申请材料如何保持表单、手册、截图与代码一致。",
  "technical_features": "采用分层输入校验、确定性结果输出和明确错误状态，核心实现均可由源码行号追溯。",
  "startup": "按照项目README中的启动入口运行，看到主界面或命令帮助即表示启动成功。",
  "interface_structure": "主要操作区域包括筛选区、工单表格、状态列和详情按钮。",
  "workflow_summary": "进入功能、提供输入、执行处理、查看结果、按提示修正异常。",
  "capabilities": [
    {
      "id": "CAP-core",
      "name": "核心处理",
      "purpose": "帮助内部服务人员查看、筛选并处理脱敏工单记录。",
      "actor": "内部工作人员",
      "entry": "浏览器首页的‘工单列表’菜单",
      "visible_elements": "筛选区、工单表格、状态列和详情按钮",
      "steps": [
        "打开工单列表并等待表格加载",
        "输入脱敏关键字并执行查询",
        "打开目标工单详情",
        "更新处理状态并保存"
      ],
      "restrictions": [
        "只使用脱敏演示数据",
        "输入必须满足界面或命令提示"
      ],
      "success_feedback": "页面显示保存成功提示，状态列同步为新的处理状态。",
      "error_feedback": "必填内容为空时页面在对应输入框旁显示校验提示，保存操作不会提交。",
      "evidence_ids": [
        "FILE-core",
        "RUNTIME-core"
      ],
      "screenshot_ids": [
        "user-shot-001"
      ]
    }
  ],
  "faq": [
    {
      "question": "操作失败后如何处理？",
      "answer": "必填内容为空时页面在对应输入框旁显示校验提示，保存操作不会提交。"
    }
  ],
  "terms": [
    {
      "term": "脱敏数据",
      "description": "不包含可识别真实个人或组织的信息。"
    }
  ],
  "confirmed_against_runtime": true,
  "generated_from_evidence": true
}
